{
  "decision_point_id": "dp-004",
  "mission_id": "m-003",
  "run_id": "run-003",
  "phase": "P3",
  "actor_id": "human-4",
  "actor_type": "human",
  "authority_role": "mission_owner",
  "mission_owner_authority_flag": true,
  "mission_owner_authority_path": "/missions/m-003/owner",
  "rationale": "Overriding previous resolution due to new information",
  "alternatives_considered": [
    "Revert",
    "Patch forward"
  ],
  "evidence_refs": [
    "ref-006"
  ],
  "state_entered_at": "2026-02-27T15:00:00+00:00",
  "recorded_at": "2026-02-27T15:00:01+00:00",
  "mission_slug": "mission-x",
  "mission_type": "software-dev"
}
