{
  "decision_point_id": "dp-001",
  "mission_id": "m-001",
  "run_id": "run-001",
  "phase": "P1",
  "actor_id": "human-1",
  "actor_type": "human",
  "authority_role": "mission_owner",
  "mission_owner_authority_flag": true,
  "mission_owner_authority_path": "/missions/m-001/owner",
  "rationale": "Initial analysis complete, decision needed",
  "alternatives_considered": [
    "Option A",
    "Option B"
  ],
  "evidence_refs": [
    "ref-001",
    "ref-002"
  ],
  "state_entered_at": "2026-02-27T12:00:00+00:00",
  "recorded_at": "2026-02-27T12:00:01+00:00",
  "mission_slug": "mission-x",
  "mission_type": "software-dev"
}
