{
  "decision_point_id": "dp-003",
  "mission_id": "m-002",
  "run_id": "run-002",
  "phase": "P1",
  "actor_id": "human-3",
  "actor_type": "human",
  "authority_role": "mission_owner",
  "mission_owner_authority_flag": true,
  "mission_owner_authority_path": "/missions/m-002/owner",
  "rationale": "Consensus reached after review",
  "alternatives_considered": [
    "Keep current",
    "Refactor"
  ],
  "evidence_refs": [
    "ref-004",
    "ref-005"
  ],
  "state_entered_at": "2026-02-27T14:00:00+00:00",
  "recorded_at": "2026-02-27T14:00:01+00:00",
  "mission_slug": "mission-x",
  "mission_type": "software-dev"
}
